{
  "id": "integration_test",
  "duration_sec": 180.0,
  "meter": {
    "numerator": 4,
    "denominator": 4
  },
  "tempo": {
    "bpm_global": 99.38401442307692,
    "curve": [
      [
        0.0,
        99.38401442307692
      ],
      [
        180.0,
        99.38401442307692
      ]
    ],
    "confidence": 0.8
  },
  "beats": [
    0.511,
    1.022,
    1.533,
    2.136,
    2.763,
    3.39,
    4.017,
    4.528,
    5.132,
    5.759,
    6.385,
    7.012,
    7.639,
    8.266,
    8.87,
    9.474,
    10.077,
    10.681,
    11.262,
    11.865,
    12.469,
    13.073,
    13.677,
    14.28,
    14.884,
    15.464,
    16.068,
    16.672,
    17.276,
    17.879,
    18.483,
    19.064,
    19.667,
    20.271,
    20.875,
    21.478,
    22.059,
    22.663,
    23.266,
    23.87,
    24.474,
    25.078,
    25.681,
    26.285,
    26.865,
    27.469,
    28.073,
    28.677,
    29.28,
    29.884,
    30.465,
    31.068,
    31.672,
    32.276,
    32.879,
    33.483,
    34.064,
    34.667,
    35.271,
    35.875,
    36.479,
    37.059,
    37.663,
    38.266,
    38.87,
    39.474,
    40.171,
    40.867,
    41.471,
    42.167,
    42.771,
    43.375,
    43.979,
    44.559,
    45.163,
    45.767,
    46.37,
    46.974,
    47.671,
    48.274,
    48.971,
    49.667,
    50.271,
    50.875,
    51.479,
    52.059,
    52.663,
    53.267,
    53.87,
    54.474,
    55.171,
    55.867,
    56.471,
    57.168,
    57.771,
    58.375,
    58.979,
    59.559,
    60.163,
    60.767,
    61.37,
    61.974,
    62.671,
    63.367,
    63.971,
    64.668,
    65.271,
    65.875,
    66.479,
    67.059,
    67.663,
    68.267,
    68.87,
    69.474,
    70.171,
    70.867,
    71.471,
    72.168,
    72.771,
    73.468,
    74.165,
    74.768,
    75.372,
    75.976,
    76.672,
    77.369,
    77.973,
    78.669,
    79.273,
    79.97,
    80.666,
    81.27,
    81.874,
    82.477,
    83.058,
    83.661,
    84.265,
    84.869,
    85.473,
    86.169,
    86.773,
    87.47,
    88.166,
    88.77,
    89.374,
    89.977,
    90.558,
    91.162,
    91.765,
    92.369,
    92.973,
    93.669,
    94.273,
    94.97,
    95.666,
    96.27,
    96.874,
    97.477,
    98.058,
    98.662,
    99.265,
    99.869,
    100.473,
    101.169,
    101.773,
    102.47,
    103.166,
    103.77,
    104.374,
    104.977,
    105.558,
    106.162,
    106.765,
    107.369,
    107.973,
    108.669,
    109.273,
    109.97,
    110.666,
    111.27,
    111.874,
    112.477,
    113.058,
    113.662,
    114.265,
    114.869,
    115.473,
    116.169,
    116.773,
    117.47,
    118.166,
    118.77,
    119.374,
    119.978,
    120.558,
    121.162,
    121.765,
    122.369,
    122.973,
    123.669,
    124.273,
    124.877,
    125.481,
    126.061,
    126.665,
    127.269,
    127.872,
    128.476,
    129.173,
    129.776,
    130.38,
    130.984,
    131.564,
    132.168
  ],
  "downbeats": [
    0.511,
    2.763,
    5.132,
    7.639,
    10.077,
    12.469,
    14.884,
    17.276,
    19.667,
    22.059,
    24.474,
    26.865,
    29.28,
    31.672,
    34.064,
    36.479,
    38.87,
    41.471,
    43.979,
    46.37,
    48.971,
    51.479,
    53.87,
    56.471,
    58.979,
    61.37,
    63.971,
    66.479,
    68.87,
    71.471,
    74.165,
    76.672,
    79.273,
    81.874,
    84.265,
    86.773,
    89.374,
    91.765,
    94.273,
    96.874,
    99.265,
    101.773,
    104.374,
    106.765,
    109.273,
    111.874,
    114.265,
    116.773,
    119.374,
    121.765,
    124.273,
    126.665,
    129.173,
    131.564
  ],
  "key": [
    {
      "start": 0.0,
      "end": 180.0,
      "tonic": "F",
      "mode": "major",
      "conf": 0.86
    }
  ],
  "chords": [
    {
      "start": 0.0,
      "end": 180.0,
      "label": "B:maj",
      "conf": 0.72
    }
  ],
  "sections": [
    {
      "start": 0.0,
      "end": 18.576,
      "label": "verse",
      "confidence": 0.75
    },
    {
      "start": 18.576,
      "end": 44.211,
      "label": "chorus",
      "confidence": 0.9
    },
    {
      "start": 44.211,
      "end": 55.914,
      "label": "chorus",
      "confidence": 0.9
    },
    {
      "start": 55.914,
      "end": 68.917,
      "label": "chorus",
      "confidence": 0.9
    },
    {
      "start": 68.917,
      "end": 89.722,
      "label": "chorus",
      "confidence": 0.9
    },
    {
      "start": 89.722,
      "end": 90.465,
      "label": "chorus",
      "confidence": 0.9
    },
    {
      "start": 90.465,
      "end": 136.348,
      "label": "chorus",
      "confidence": 0.9
    }
  ],
  "lyrics": [],
  "performance": {
    "melody": [],
    "bass": []
  },
  "provenance": {
    "separation": "pending",
    "asr": "pending",
    "harmony": "pending",
    "git_sha": "dev",
    "created_at": "2025-10-01T00:17:06Z"
  }
}