{
  "id": "complete_test",
  "duration_sec": 8.0,
  "meter": {
    "numerator": 4,
    "denominator": 4
  },
  "tempo": {
    "bpm_global": 117.45383522727273,
    "curve": [
      [
        0.0,
        117.45383522727273
      ],
      [
        8.0,
        117.45383522727273
      ]
    ],
    "confidence": 0.8
  },
  "beats": [
    0.534,
    1.045,
    1.533,
    2.043,
    2.531,
    3.042,
    3.529,
    4.04,
    4.528,
    5.039,
    5.55,
    6.037,
    6.548,
    7.036,
    7.546
  ],
  "downbeats": [
    0.534,
    2.531,
    4.528,
    6.548
  ],
  "key": [
    {
      "start": 0.0,
      "end": 8.0,
      "tonic": "D#",
      "mode": "minor",
      "conf": 0.78
    }
  ],
  "chords": [
    {
      "start": 0.0,
      "end": 8.0,
      "label": "A:maj",
      "conf": 0.62
    },
    {
      "start": 8.0,
      "end": 8.0,
      "label": "F:maj",
      "conf": 0.63
    }
  ],
  "sections": [
    {
      "start": 0.534,
      "end": 6.548,
      "label": "intro",
      "confidence": 0.85
    }
  ],
  "lyrics": [],
  "performance": {
    "melody": [
      {
        "time": 0.096,
        "midi": 69,
        "velocity": 107,
        "duration": 7.936,
        "confidence": 0.931
      }
    ],
    "bass": [
      {
        "time": 0.064,
        "midi": 50,
        "velocity": 107,
        "duration": 7.808,
        "confidence": 0.926
      }
    ]
  },
  "provenance": {
    "separation": "pending",
    "asr": "pending",
    "harmony": "pending",
    "git_sha": "dev",
    "created_at": "2025-09-30T21:12:47Z"
  }
}