{
  "id": "b72e82dc",
  "duration_sec": 5.0,
  "meter": {
    "numerator": 4,
    "denominator": 4
  },
  "tempo": {
    "bpm_global": 0.0,
    "curve": [
      [
        0.0,
        0.0
      ],
      [
        5.0,
        0.0
      ]
    ],
    "confidence": 0.8
  },
  "beats": [],
  "downbeats": [],
  "key": [
    {
      "start": 0.0,
      "end": 5.0,
      "tonic": "D#",
      "mode": "minor",
      "conf": 0.84
    },
    {
      "start": 0.0,
      "end": 5.0,
      "tonic": "D#",
      "mode": "minor",
      "conf": 0.84
    }
  ],
  "chords": [
    {
      "start": 0.0,
      "end": 0.5,
      "label": "D:maj",
      "conf": 0.61
    },
    {
      "start": 0.5,
      "end": 1.0,
      "label": "F:maj",
      "conf": 0.58
    },
    {
      "start": 1.0,
      "end": 4.5,
      "label": "D:maj",
      "conf": 0.58
    },
    {
      "start": 4.5,
      "end": 5.0,
      "label": "F:maj",
      "conf": 0.58
    },
    {
      "start": 5.0,
      "end": 5.0,
      "label": "D:maj",
      "conf": 0.61
    },
    {
      "start": 0.0,
      "end": 0.5,
      "label": "D:maj",
      "conf": 0.61
    },
    {
      "start": 0.5,
      "end": 1.0,
      "label": "F:maj",
      "conf": 0.58
    },
    {
      "start": 1.0,
      "end": 4.5,
      "label": "D:maj",
      "conf": 0.58
    },
    {
      "start": 4.5,
      "end": 5.0,
      "label": "F:maj",
      "conf": 0.58
    },
    {
      "start": 5.0,
      "end": 5.0,
      "label": "D:maj",
      "conf": 0.61
    }
  ],
  "sections": [
    {
      "start": 0.0,
      "end": 0.5,
      "label": "intro",
      "confidence": 0.85
    },
    {
      "start": 0.5,
      "end": 1.0,
      "label": "chorus",
      "confidence": 0.9
    },
    {
      "start": 1.0,
      "end": 4.5,
      "label": "chorus",
      "confidence": 0.9
    },
    {
      "start": 4.5,
      "end": 5.0,
      "label": "outro",
      "confidence": 0.85
    },
    {
      "start": 0.0,
      "end": 0.5,
      "label": "intro",
      "confidence": 0.85
    },
    {
      "start": 0.5,
      "end": 1.0,
      "label": "chorus",
      "confidence": 0.9
    },
    {
      "start": 1.0,
      "end": 4.5,
      "label": "chorus",
      "confidence": 0.9
    },
    {
      "start": 4.5,
      "end": 5.0,
      "label": "outro",
      "confidence": 0.85
    }
  ],
  "lyrics": [],
  "performance": {
    "melody": [
      {
        "time": 0.0,
        "midi": 69,
        "velocity": 109,
        "duration": 5.024,
        "confidence": 0.984
      },
      {
        "time": 0.0,
        "midi": 69,
        "velocity": 109,
        "duration": 5.024,
        "confidence": 0.984
      }
    ],
    "bass": [
      {
        "time": 0.0,
        "midi": 50,
        "velocity": 108,
        "duration": 5.024,
        "confidence": 0.939
      },
      {
        "time": 0.0,
        "midi": 50,
        "velocity": 108,
        "duration": 5.024,
        "confidence": 0.939
      }
    ]
  },
  "provenance": {
    "separation": "pending",
    "asr": "pending",
    "harmony": "pending",
    "git_sha": "dev",
    "created_at": "2025-10-01T00:00:58Z"
  }
}