{
  "id": "test_simple",
  "duration_sec": 10.0,
  "meter": {
    "numerator": 4,
    "denominator": 4
  },
  "tempo": {
    "bpm_global": 120.0,
    "confidence": 0.9
  },
  "beats": [0.5, 1.0, 1.5, 2.0, 2.5, 3.0],
  "downbeats": [0.5, 2.5],
  "key": [
    {
      "start": 0.0,
      "end": 10.0,
      "tonic": "C",
      "mode": "major",
      "conf": 0.95
    }
  ],
  "chords": [
    {
      "start": 0.0,
      "end": 2.0,
      "label": "C:maj",
      "conf": 0.8
    },
    {
      "start": 2.0,
      "end": 4.0,
      "label": "F:maj",
      "conf": 0.85
    },
    {
      "start": 4.0,
      "end": 6.0,
      "label": "G:maj",
      "conf": 0.9
    },
    {
      "start": 6.0,
      "end": 10.0,
      "label": "C:maj",
      "conf": 0.95
    }
  ],
  "sections": [
    {
      "start": 0.0,
      "end": 10.0,
      "label": "verse",
      "confidence": 0.9
    }
  ],
  "lyrics": [
    {
      "start": 0.5,
      "end": 0.8,
      "text": "Hel",
      "conf": 0.95
    },
    {
      "start": 0.8,
      "end": 1.1,
      "text": "lo",
      "conf": 0.98
    },
    {
      "start": 1.2,
      "end": 1.5,
      "text": "world",
      "conf": 0.92
    },
    {
      "start": 3.0,
      "end": 3.3,
      "text": "Good",
      "conf": 0.94
    },
    {
      "start": 3.3,
      "end": 3.6,
      "text": "bye",
      "conf": 0.96
    }
  ],
  "provenance": {
    "source_path": "/audio/test_song.wav",
    "created_at": "2025-10-01T00:00:00Z"
  }
}
