{
  "id": "integration_test",
  "duration_sec": 5.0,
  "meter": {
    "numerator": 4,
    "denominator": 4
  },
  "tempo": {
    "bpm_global": 0.0,
    "curve": [
      [
        0.0,
        0.0
      ],
      [
        5.0,
        0.0
      ]
    ],
    "confidence": 0.8
  },
  "beats": [],
  "downbeats": [],
  "key": [
    {
      "start": 0.0,
      "end": 5.0,
      "tonic": "D#",
      "mode": "minor",
      "conf": 0.84
    }
  ],
  "chords": [],
  "sections": [],
  "lyrics": [],
  "performance": {
    "melody": [],
    "bass": []
  },
  "provenance": {
    "separation": "pending",
    "asr": "pending",
    "harmony": "pending",
    "git_sha": "dev",
    "created_at": "2025-10-01T00:02:36Z"
  }
}