{
  "id": "yt_demo",
  "duration_sec": 210.5,
  "meter": {
    "numerator": 4,
    "denominator": 4
  },
  "tempo": {
    "bpm_global": 112.8,
    "curve": [
      [
        0.0,
        112.8
      ],
      [
        95.3,
        114.1
      ]
    ],
    "confidence": 0.86
  },
  "beats": [
    0.0,
    0.53,
    1.06
  ],
  "downbeats": [
    0.0,
    2.12,
    4.24
  ],
  "key": [
    {
      "start": 0.0,
      "end": 120.0,
      "tonic": "G",
      "mode": "major",
      "conf": 0.74
    }
  ],
  "chords": [
    {
      "start": 0.0,
      "end": 2.12,
      "label": "G",
      "conf": 0.68
    },
    {
      "start": 2.12,
      "end": 4.24,
      "label": "Em",
      "conf": 0.65
    }
  ],
  "sections": [
    {
      "start": 0.0,
      "end": 12.7,
      "label": "intro"
    },
    {
      "start": 12.7,
      "end": 38.1,
      "label": "verse"
    }
  ],
  "lyrics": [
    {
      "start": 13.02,
      "end": 15.1,
      "text": "when I was young",
      "conf": 0.82
    }
  ],
  "performance": {
    "melody": [
      {
        "start": 12.72,
        "end": 12.95,
        "midi": 67,
        "conf": 0.83
      }
    ],
    "bass": [
      {
        "start": 0.0,
        "end": 0.5,
        "midi": 43,
        "conf": 0.78
      }
    ]
  },
  "provenance": {
    "separation": "demucs-v4",
    "asr": "whisper-large-v3",
    "harmony": "cnn-bilstm-crf@init",
    "git_sha": "dev",
    "created_at": "2025-09-24T00:00:00Z"
  }
}